{
  "version": 1,
  "session_id": "0f9d3d1b2c3a4e5f6a7b8c9d0e1f2a3b",
  "sender_id": "member-1",
  "event_id": "5b1f0d2c-3a4b-4c5d-8e9f-0a1b2c3d4e5f",
  "event_type": "AVATAR_THOUGHT",
  "seq": "42",
  "revision": "7",
  "epoch": "3",
  "timestamp": "2026-10-17T10:15:00Z",
  "payload": { "avatar_id": "pm", "status": "Drafting", "public_summary": "Drafting epics" }
}
